{
  "semgraph": "movingWindowAverage",
  "metric": "uniqueVisitors",
  "title": "Unieke bezoekers per dag (voorbeelddata)",
  "measureType": "unique",
  "window": 7,
  "locale": "nl-BE",
  "context": {
    "domain": "Web",
    "dataset": "sessies",
    "reliability": "voorbeelddata"
  },
  "points": [
    { "end": "2026-08-19", "mean": 1517, "sd": 479.5748 },
    { "end": "2026-08-26", "mean": 1792.1429, "sd": 342.6862 },
    { "end": "2026-09-02", "mean": 1948.7143, "sd": 504.3543 },
    { "end": "2026-09-09", "mean": 1917, "sd": 393.8951 },
    { "end": "2026-09-16", "mean": 1969.8571, "sd": 331.5285 },
    { "end": "2026-09-23", "mean": 2017.4286, "sd": 449.9796 },
    { "end": "2026-09-30", "mean": 2096.7143, "sd": 416.656 }
  ]
}
